Disease,Description,Gene,Example variant,Mutation type,Functional effect
Hemochromatosis,Excess iron absorption from diet,HJV,NM_213653.3:c.959G>T,Missense SNV,Likely LOF
Thalassemia,Blood disorder that obstructs production of hemaglobin in blood.,"HBA1, HBA2",NM_000558.5(HBA1):c.2T>G (p.Met1Arg),Missense SNV,Start loss due to disruption of the initiator methionine
Cystic fibrosis,"Cystic fibrosis is an inherited disease characterized by the buildup of thick, sticky mucus that can damage many of the body's organs. The disorder's most common signs and symptoms include progressive damage to the respiratory system and chronic digestive system problems.", CFTR (7q31.2); FCGR2A (1q23.3); TGFB1 (19q13.2),NM_000492.4(CFTR):c.-9_14del (p.Met1fs),"Deletion, frameshift initiator codon variant",May impact translation initiation or efficiency
Tay-Sachs disease,"Tay-Sachs disease is a rare, inherited disorder that is characterized by neurological problems caused by  the death of nerve cells (neurons) in the brain and spinal cord (central nervous system).", HEXA,NM_000520.6(HEXA):c.1176G>A (p.Trp392Ter),Nonsense SNV,"Nonsense mediated decay, truncation, or a dysfunctional protein product"
Lung adenocarcinoma,"A carcinoma that arises from the lung and is characterized by the presence of malignant glandular epithelial cells. Usually lung adenocarcinoma is asymptomatic and is identified through screening studies or as an incidental radiologic finding. If clinical symptoms are present they include shortness of breath, cough, hemoptysis, chest pain, and fever. Tobacco smoke is a known risk factor.",EGFR,NM_005228.5(EGFR):c.2573T>G (p.Leu858Arg),Missense SNV,Sensitivity to 2 tyrosine kinase inhibitors
